{
  "schema_version": "v1",
  "packet_id": "interoperability-signoff-72feafbdefe8",
  "overallSignoffStatus": "open",
  "reviewerId": "runtime.reviewer",
  "reviewerRole": "regulatory_reviewer",
  "sourceRemediationBundleId": "interoperability-remediation-a1a5aca6cf3a",
  "sourceDossierId": "adapter-review-dossier-5e801cc2614b",
  "sourcePreviewProfileId": "oht_85_iuclid_json_preview",
  "targetProfile": {
    "profileId": "eu_internal_exchange_preview",
    "displayName": "EU internal exchange preview",
    "jurisdiction": "eu",
    "intendedUse": "Internal exchange of a staged OHT/IUCLID-aligned JSON preview for review workflows.",
    "allowedPreviewProfiles": [
      "oht_85_iuclid_json_preview"
    ],
    "requiredDossierReadinessProfile": "eu_internal_review",
    "notes": [
      "Unsupported fields and derived mappings remain review items rather than blockers for internal exchange."
    ]
  },
  "linkedDossierReadinessProfile": "eu_internal_review",
  "linkedDossierReadinessStatus": "review_required",
  "actionItems": [
    {
      "actionId": "upgrade_linked_dossier_readiness",
      "ruleId": "linked_dossier_readiness",
      "title": "Upgrade linked dossier readiness",
      "actionType": "governance_upgrade",
      "priority": "review_required",
      "blocking": false,
      "summary": "The linked version-pinned dossier does not satisfy the dossier-readiness profile required by the selected exchange gate.",
      "triggerMessage": "Linked dossier readiness assessment requires human review before treating the preview as exchange-ready.",
      "triggerNote": "eu_internal_review",
      "decisionStatus": "pending",
      "rationale": null,
      "reviewedAt": null,
      "supportingUris": [],
      "resolved": false
    },
    {
      "actionId": "review_unsupported_preview_fields",
      "ruleId": "preview_unsupported_fields_allowed",
      "title": "Review unsupported preview fields",
      "actionType": "manual_review",
      "priority": "review_required",
      "blocking": false,
      "summary": "Unsupported local-only fields remain in the staged preview workflow and require review before relying on the current gate outcome.",
      "triggerMessage": "Preview still carries unsupported local-only fields that require review or block the selected gate.",
      "triggerNote": "confidentiality_annotations, review_bundle.check_result.header_resolution, review_bundle.check_result.input_headers, review_bundle.comparison_result.compared_fields, review_bundle.comparison_result.matched_fields",
      "decisionStatus": "pending",
      "rationale": null,
      "reviewedAt": null,
      "supportingUris": [],
      "resolved": false
    },
    {
      "actionId": "replace_non_direct_mappings",
      "ruleId": "preview_non_direct_mappings_allowed",
      "title": "Replace non-direct mappings",
      "actionType": "mapping_hardening",
      "priority": "review_required",
      "blocking": false,
      "summary": "Derived or review-required mappings remain in the staged preview and block or downgrade the selected exchange gate.",
      "triggerMessage": "Preview still depends on derived or review-required mappings that require review or block the selected gate.",
      "triggerNote": "model_governance_snapshot, pinned_resources, review_bundle.check_result.normalized_projection.commodity_contributions, source_governance_snapshot",
      "decisionStatus": "pending",
      "rationale": null,
      "reviewedAt": null,
      "supportingUris": [],
      "resolved": false
    }
  ],
  "pendingActionIds": [
    "upgrade_linked_dossier_readiness",
    "review_unsupported_preview_fields",
    "replace_non_direct_mappings"
  ],
  "acknowledgedActionIds": [],
  "completedActionIds": [],
  "waivedActionIds": [],
  "unresolvedBlockingActionIds": [],
  "referencedResources": [
    {
      "role": "remediation_catalog",
      "uri": "interoperability-remediation://catalog",
      "description": "Governed remediation catalog for interoperability readiness outcomes.",
      "confidentialityTag": "public",
      "sanitisationState": "retained"
    },
    {
      "role": "interoperability_readiness_profile",
      "uri": "interoperability-readiness://profile/eu_internal_exchange_preview",
      "description": "Governed interoperability readiness profile used for this assessment.",
      "confidentialityTag": "public",
      "sanitisationState": "retained"
    },
    {
      "role": "interoperability_preview_profile",
      "uri": "interoperability://profile/oht_85_iuclid_json_preview",
      "description": "Governed staged preview profile used to construct the interoperability preview.",
      "confidentialityTag": "public",
      "sanitisationState": "retained"
    },
    {
      "role": "interoperability_readiness_docs",
      "uri": "docs://interoperability-readiness",
      "description": "Operator guide for interoperability readiness semantics and exchange gates.",
      "confidentialityTag": "public",
      "sanitisationState": "retained"
    },
    {
      "role": "interoperability_remediation_docs",
      "uri": "docs://interoperability-remediation",
      "description": "Operator guide for governed interoperability remediation bundles.",
      "confidentialityTag": "public",
      "sanitisationState": "retained"
    },
    {
      "role": "interoperability_remediation_validation",
      "uri": "validation://interoperability-remediation-actions",
      "description": "Governed remediation action catalog keyed to interoperability readiness rule ids.",
      "confidentialityTag": "public",
      "sanitisationState": "retained"
    },
    {
      "role": "documentation",
      "uri": "docs://regulatory-governance",
      "description": "Documentation linked from remediation action upgrade_linked_dossier_readiness.",
      "confidentialityTag": "public",
      "sanitisationState": "retained"
    },
    {
      "role": "documentation",
      "uri": "docs://interoperability-readiness",
      "description": "Documentation linked from remediation action upgrade_linked_dossier_readiness.",
      "confidentialityTag": "public",
      "sanitisationState": "retained"
    },
    {
      "role": "remediation_resource",
      "uri": "validation://readiness-profiles",
      "description": "Resource linked from remediation action upgrade_linked_dossier_readiness.",
      "confidentialityTag": "public",
      "sanitisationState": "retained"
    },
    {
      "role": "remediation_resource",
      "uri": "validation://regulatory-rules",
      "description": "Resource linked from remediation action upgrade_linked_dossier_readiness.",
      "confidentialityTag": "public",
      "sanitisationState": "retained"
    },
    {
      "role": "remediation_resource",
      "uri": "validation://interoperability-readiness-profiles",
      "description": "Resource linked from remediation action upgrade_linked_dossier_readiness.",
      "confidentialityTag": "public",
      "sanitisationState": "retained"
    },
    {
      "role": "documentation",
      "uri": "docs://interoperability-preview",
      "description": "Documentation linked from remediation action review_unsupported_preview_fields.",
      "confidentialityTag": "public",
      "sanitisationState": "retained"
    },
    {
      "role": "remediation_resource",
      "uri": "validation://interoperability-profiles",
      "description": "Resource linked from remediation action review_unsupported_preview_fields.",
      "confidentialityTag": "public",
      "sanitisationState": "retained"
    },
    {
      "role": "remediation_resource",
      "uri": "validation://interoperability-rules",
      "description": "Resource linked from remediation action review_unsupported_preview_fields.",
      "confidentialityTag": "public",
      "sanitisationState": "retained"
    },
    {
      "role": "interoperability_signoff_docs",
      "uri": "docs://interoperability-signoff",
      "description": "Operator guide for reviewer-facing interoperability signoff packets.",
      "confidentialityTag": "public",
      "sanitisationState": "retained"
    }
  ],
  "notes": [
    "Signoff packet is a reviewer-facing overlay on top of the remediation bundle and does not alter the underlying readiness outcome.",
    "Waived actions remain explicitly visible so downstream reviewers can inspect the rationale for any accepted deviation.",
    "Signed-off status does not imply XML generation readiness, submission acceptance, or regulatory approval."
  ]
}
